{
  "finding_id": "ft-t1550-001-r013-token-reuse-001",
  "technique_id": "T1550.001",
  "technique_name": "Use Alternate Authentication Material: Application Access Token",
  "run_id": "R013",
  "severity": "high",
  "confidence": "high",
  "control_mapping_id": "ft1550-001-rbac-directory-readers-001",
  "evidence": [
    "samples/replay-log/R013.json"
  ],
  "triage_status": "open",
  "notes": "One delegated token silently reused across all 13 successful reads in the R013 full sweep (14 token_event entries, flow=silent, persistence_kind=encrypted, cache_path redacted). High per rubric (D=3 token/credential material; operates through the authentication control, a cached token needs no fresh MFA). Recurring: also observed in R007/R011/R012. Cross-references Directory Readers (RBAC).",
  "triage_metadata": {
    "created_utc": "2026-09-03T00:00:00Z",
    "author": "rejewski",
    "schema_version": "0.1"
  }
}
