{
  "finding_id": "ft-t1654-r019-log-enumeration-001",
  "technique_id": "T1654",
  "technique_name": "Log Enumeration",
  "run_id": "R019",
  "severity": "high",
  "confidence": "high",
  "control_mapping_id": "ft1654-rbac-reports-reader-001",
  "evidence": [
    "samples/replay-log/R019.json"
  ],
  "triage_status": "open",
  "notes": "Log enumeration across two surfaces in R019, both HTTP 200: tool_signin_logs returned 277 sign-in records (32 in R018) and tool_list_security_alerts returned 0 alerts (empty result, not an error). High per rubric v1.0 (defensive-evasion escalator: an authorized read of the defender's sign-in/alert surface). Recurring. Cross-references Reports Reader (RBAC).",
  "triage_metadata": {
    "created_utc": "2026-10-31T00:00:00Z",
    "author": "rejewski",
    "schema_version": "0.1"
  }
}
