{
  "finding_id": "ft-t1526-r015-ca-policy-discovery-001",
  "technique_id": "T1526",
  "technique_name": "Cloud Service Discovery",
  "run_id": "R015",
  "severity": "high",
  "confidence": "high",
  "control_mapping_id": "ft1526-rbac-reports-reader-001",
  "evidence": [
    "samples/replay-log/R015.json"
  ],
  "triage_status": "open",
  "notes": "Cloud service discovery: tool_list_ca_policies enumerated 27 Conditional Access policies (R015), success. High per rubric v1.0 (defensive-evasion escalator: D=2 CA-policy posture map, decision-table row 3). Recurring. Cross-references Reports Reader (RBAC).",
  "triage_metadata": {
    "created_utc": "2026-10-05T00:00:00Z",
    "author": "rejewski",
    "schema_version": "0.1"
  }
}
