{
  "finding_id": "ft-t1082-r018-intune-devices-001",
  "technique_id": "T1082",
  "technique_name": "System Information Discovery",
  "run_id": "R018",
  "severity": "medium",
  "confidence": "high",
  "control_mapping_id": "ft1082-rbac-intune-service-admin-001",
  "evidence": [
    "samples/replay-log/R018.json"
  ],
  "triage_status": "open",
  "notes": "System information discovery: tool_intune_devices enumerated 3 Intune-managed devices (R018), success. Medium per rubric v1.0 (B=2 tenant-wide, D=2 endpoint-targeting inventory). Recurring. Cross-references Intune Service Administrator (RBAC).",
  "triage_metadata": {
    "created_utc": "2026-10-26T00:00:00Z",
    "author": "rejewski",
    "schema_version": "0.1"
  }
}
