{
  "finding_id": "ft-t1069-003-r014-group-discovery-001",
  "technique_id": "T1069.003",
  "technique_name": "Permission Groups Discovery: Cloud Groups",
  "run_id": "R014",
  "severity": "medium",
  "confidence": "high",
  "control_mapping_id": "ft1069-003-ca-sif001-signinfrequency-8h-001",
  "evidence": [
    "samples/replay-log/R014.json"
  ],
  "triage_status": "open",
  "notes": "Permission-groups discovery: tool_list_groups enumerated 23 groups (R014 full sweep), success. Severity medium per docs/finding-severity-rubric-v0.1.md v1.0 (B=2 tenant-wide, D=2 group/privilege map). Recurring (R010-R013). Cross-references CA-SIF001-SignInFrequency-8h.",
  "triage_metadata": {
    "created_utc": "2026-09-22T00:00:00Z",
    "author": "rejewski",
    "schema_version": "0.1"
  }
}
