{
  "finding_id": "ft-t1213-002-r017-sharepoint-sites-001",
  "technique_id": "T1213.002",
  "technique_name": "Data from Information Repositories: SharePoint",
  "run_id": "R017",
  "severity": "medium",
  "confidence": "high",
  "control_mapping_id": "ft1213-002-ca-spo-001-requirecompliantapp-001",
  "evidence": [
    "samples/replay-log/R017.json"
  ],
  "triage_status": "open",
  "notes": "SharePoint information-repository discovery: tool_list_sharepoint_sites enumerated 2 site collections (R017), success. Medium per rubric v1.0 (B=2 tenant-wide, D=2 repository target list). Recurring (first evidenced R013). Cross-references CA-SPO-001-RequireCompliantApp.",
  "triage_metadata": {
    "created_utc": "2026-10-19T00:00:00Z",
    "author": "rejewski",
    "schema_version": "0.1"
  }
}
