{
  "finding_id": "ft-t1087-004-r015-account-discovery-001",
  "technique_id": "T1087.004",
  "technique_name": "Account Discovery: Cloud Account",
  "run_id": "R015",
  "severity": "medium",
  "confidence": "high",
  "control_mapping_id": "ft1087-004-ca-cov008-blockbylocation-001",
  "evidence": [
    "samples/replay-log/R015.json"
  ],
  "triage_status": "open",
  "notes": "Account discovery across five surfaces in the R015 full sweep, all success: tool_list_users (9), tool_list_applications (10), tool_list_role_assignments (16), tool_list_service_principals (439), tool_list_oauth_grants (23). Service-principal count grew 432->439 since R014. Medium per rubric v1.0 (B=2 tenant-wide read, D=2 directory/identity target map). Recurring (R010-R014). Cross-references CA-COV008-BlockByLocation.",
  "triage_metadata": {
    "created_utc": "2026-10-05T00:00:00Z",
    "author": "rejewski",
    "schema_version": "0.1"
  }
}
