{
  "finding_id": "ft-t1654-r011-signin-logs-001",
  "technique_id": "T1654",
  "technique_name": "Log Enumeration",
  "run_id": "R011",
  "severity": "high",
  "confidence": "high",
  "control_mapping_id": "ft1654-rbac-reports-reader-001",
  "evidence": [
    "samples/replay-log/R011.json"
  ],
  "triage_status": "reviewed",
  "notes": "30 sign-in records enumerated via GET /auditLogs/signIns in cloudharbordemo sandbox; outcome=success. Cross-references Reports Reader RBAC preventive control. Re-triaged medium -> high (2026-09-10) per docs/finding-severity-rubric-v0.1.md v1.0: the defensive-evasion escalator was ADOPTED — sign-in/alert telemetry is a defender's-own-detection map (D=2 sub-case (b)) and routes to high via decision-table row 3. Original point-in-time assessment (v0.2) was medium; preserved here for context.",
  "triage_metadata": {
    "created_utc": "2026-07-18T00:00:00Z",
    "author": "rejewski",
    "schema_version": "0.1"
  }
}
